{"alert_id":"am-checkout-5xx-20261005-01","breach_duration_s":300,"check":"http_5xx","fingerprint":"0123456789abcdef","labels":{"cluster":"prod-eu","env":"prod","region":"eu-west","team":"checkout"},"metric_threshold":0.01,"metric_value":0.043,"received_at":"2026-10-05T14:40:02+00:00","service":"checkout","severity_in":"error","title":"checkout 5xx rate 4.3% over 5m"}