{"alert_id":"db-latency-p99-prod-20261005","breach_duration_s":null,"check":"latency","fingerprint":"a1b2c3d4e5f60718","labels":{"cluster":"prod-eu","env":"prod","region":"eu-west","team":"databases"},"metric_threshold":null,"metric_value":null,"received_at":"2026-10-05T14:39:55+00:00","service":"postgres-primary","severity_in":"critical","title":"DB latency p99 > 2s for 5 minutes"}